Unnamed: 0,rank,asin,product_title,product_price,product_star_rating,product_num_ratings,product_url,product_photo,Total Reviews,Total Ratings,Review ID,Review Title,Review Comment,Review Star Rating,Review Link,Review Author Avatar,Is Verified Purchase,Reviewed Product ASIN,review_date,num_people_helpful,sentiment,tags,sentiment_score,category
120,13,B0CFPJYX7P,"All-new Amazon Kindle Paperwhite (16 GB) – Our fastest Kindle ever, with new 7"" glare-free display and weeks of battery life ",$129.99,4.2,437,https://www.amazon.com/dp/B0CFPJYX7P,"https://images-na.ssl-images-amazon.com/images/I/61MdbBO+SEL._AC_UL900_SR900,600_.jpg",349,599,R6KQFW716AKR9,Perfection,"I have the Kindle Basic 11th generation. I had the paper white 11th generation but I gave it to my niece because it was hurting my eyesight. It was too bright and a bit hazy - even in dark mode. I did not enjoy the reading experience. I also owned the Libra Colour but returned it. I didn't love it as much as I thought it would. I prefer not using turn page buttons. And it is not up to par with any Kindle, I'm sorry to say.  I will not be purchasing the Colorsoft because it's pretty much the same
 color ink technology as the Kobo. Color is a nice novelty but not a necessity. It's also not necessary to upgrade to the new Kindles. But, oh...what a difference than it's predecessor. The design of the device fees good to hold and is a very cozy experience. The display is a bit larger, the rounded corners are seamless. The screen looks crispier (clearer) but easier on the eyes. It's like you are reading on paper - not a stark white tablet screen. Dark mode is also easier on the eyes. It is also fast! For an e-reader and definitely faster than the previous paperwhite. No other technology can
beat reading on a Kindle device. If you are sensitive to blue light or get migraines - this upgrade is worth it. Its an excellent e-reader.",5,https://www.amazon.com/gp/customer-reviews/R6KQFW716AKR9,"https://images-na.ssl-images-amazon.com/images/S/amazon-avatars-global/default._CR0,0,1024,1024_SX48_.png",True,B0CFPTK5JG,2024-10-20,274.0,positive,['love'],0.9744,electronics
121,13,B0CFPJYX7P,"All-new Amazon Kindle Paperwhite (16 GB) – Our fastest Kindle ever, with new 7"" glare-free display and weeks of battery life ",$129.99,4.2,437,https://www.amazon.com/dp/B0CFPJYX7P,"https://images-na.ssl-images-amazon.com/images/I/61MdbBO+SEL._AC_UL900_SR900,600_.jpg",349,599,R1BKFA4I74EEO2,THIS OASIS OWNER LOVES THE NEW PAPERWHITE!!,"I have been using my Oasis daily for 7.5 years and the battery life is not so good any longer and the famed buttons aren't working so well anymore either! After the release of the new Kindles and the lack of one with the physical page turn buttons I decided to order the new Paperwhite and I LOVE it and encourage other oasis owners to give it a try and get over the buttons! This Paperwhite is crisp, lightweight, and very fast in turning the pages.....I couldn't really ask for more. I never had a glare problem with any of my previous Kindles so I can't speak to that. I would encourage people to use dark mode if they are subject to migraines/headaches....I used to be only able to read for about 20 minutes and then my migraine pain would start but when Amazon came out with dark mode years ago that problem went away completely....it also does away with the screen too yellow problem others talk about, even though you can control that with the warm light slider control.  People seem to just nit pick the new Kindles and I just don't share their complaints...I have never had a problem with location of the power button & another user complained that you can't clean the screen of this Paperwhite because it will just turn pages....ridiculous! On the toolbar menu at the top if you tap on the 'more' button there is an option to disable the touchscreen...tap on that and clean away, no problem! I will agree that this non-glare screen seems to show fingerprints more but I always wipe my phone screen off every morning so I just do my new Paperwhite at the same time. I read many hours a day, every day, and have had many kindles since the original in 2007 and in my opinion they just continue to get better.  I thought maybe I would miss the page turn buttons, but I do not, not at all! This new Paperwhite turns pages so easily and quickly that I don't miss the buttons....I hold my kindle on the side with one hand (and I have small arthritic hands)  and just move my thumb about a quarter inch and tap the side of the screen...it is so easy, quick and automatic that I don't even think about it.  I think people just like to complain....I love to read and this Paperwhite gives me a superb reading experience and I highly recommend it.",5,https://www.amazon.com/gp/customer-reviews/R1BKFA4I74EEO2,"https://images-na.ssl-images-amazon.com/images/S/amazon-avatars-global/default._CR0,0,1024,1024_SX48_.png",True,B0CFPJYX7P,2024-11-04,148.0,positive,"['life', 'love']",0.9943,electronics
122,13,B0CFPJYX7P,"All-new Amazon Kindle Paperwhite (16 GB) – Our fastest Kindle ever, with new 7"" glare-free display and weeks of battery life ",$129.99,4.2,437,https://www.amazon.com/dp/B0CFPJYX7P,"https://images-na.ssl-images-amazon.com/images/I/61MdbBO+SEL._AC_UL900_SR900,600_.jpg",349,599,RO6OVWBCXRE94,"Is it worth upgrading?  Unfortunately Yes, a very resounding yes!","I've had my Kindle since 2013, I've probably read over 1,000 books on this little piece of equipment over the past 11 years as it's been the most convenient piece of electronics I've carried with me on my travels.  I originally bought my Kindle to replace a Sony e-reader I had because the glare on the Sony version made it impossible to use outside and in brightly lit rooms, upgrading to Amazon's Kindle was a huge game changer for me.

I've been resistant to upgrading my Kindle for the past 5 years because, why would I? My 2013 Kindle still works quite well, the battery life is very long, and sure, I need to reboot it every few weeks otherwise it's too slow to use, and yes, it has issues connecting to my wifi every other month.  These were minor inconveniences that didn't seem to be worth fixing for $150+.  Well, I received my new Kindle Paperwhite yesterday and my first thought was - wow, this is a lot lighter.  Then I turned it on and I was sold!  Lightening fast, responsive, warmer backlight, larger screen, and significantly improved contrast for sharper letters.

When I bought my first e-reader in 2011 (Sony), I had to turn it off during take off and landing. We've come a long way since then and we know that an e-reader and other small personal electronics don't impact airplane instruments and you can read away non-stop on flights.  If you're putting off upgrading an old Kindle, and you have the money to do so, don't wait, this Kindle is far superior to models made over a decade ago; and, if you haven't done so, connect your Kindle to your local library for essentially an unlimited supply of free reading material.",5,https://www.amazon.com/gp/customer-reviews/RO6OVWBCXRE94,"https://images-na.ssl-images-amazon.com/images/S/amazon-avatars-global/default._CR0,0,1024,1024_SX48_.png",True,B0CFPJYX7P,2024-11-24,50.0,positive,['life'],0.9851,electronics
123,13,B0CFPJYX7P,"All-new Amazon Kindle Paperwhite (16 GB) – Our fastest Kindle ever, with new 7"" glare-free display and weeks of battery life ",$129.99,4.2,437,https://www.amazon.com/dp/B0CFPJYX7P,"https://images-na.ssl-images-amazon.com/images/I/61MdbBO+SEL._AC_UL900_SR900,600_.jpg",349,599,R2N2C0JP3FPQSM,Perfect little carry-along...,"I'm a relatively new e-ink convert, having bought a tricked-out Kindle Scribe exactly two years ago (when the device was brand new). Long story short? I loved that device... Literally, to death... After dropping it on terrazzo floors in SEVERAL airports world-wide, not to mention the myriad spills at home on more forgiving carpet. In fact, I loved it so much that when the 11th gen Scribe went on fire-sale a few weeks ago, I bought the cheapest version to replace my original (recently non-functional) unit, simply swapping my old premium pen for the basic one. Clearly, I loved the device enough to buy it again... I adore the ability to mark up .pdf's, the note-taking capabilities and that even with this extra functionality, it's still a very limited device that allows me to focus on reading first.

What I don't love, and never have? The weight. It's heavy to the point that I never used it if I couldn't prop it on something. Which led to it being dropped. A lot. Which led to the original unit failing. Not that it wasn't pretty sturdy... I mean, it survived repeated collisions with very unforgiving surfaces. It even weathered some relatively large liquid spills on and near it despite not being water resistant.  Now? I just use the Scribe when I need to mark up .pdf's (like, when I'm gaming... I can keep my character sheets on the Kindle), or need something that can display larger printed materials... Like RPG basic books or comics.  Hence, the new Kindle Paperwhite gen 12...

My new device isn't appreciably different than my Scribe except in a couple very important ways. The reviews don't lie... The screen contrast is higher, and in good light without backlighting, looks whiter. The device is much smaller, and seems a touch slimmer. It's also, very importantly, less than half as heavy, which means it's comfortable to hold in one hand while reading without tiring. I don't need to set it down on things, or prop it up, which reduces the threat of drops. When I'm out in public, I do have a cover for the device, and because it's so light, you can hold it open like a paperback, and it won't overbalance and fall out of your hand. The screen, given that it's half the size of the Scribe, seems to refresh much faster. It also seems to load the store faster, and settings menu navigation is measurably faster, as well. This is not surprising. The device is newer, and has less functionality. The one thing that I have detracted a star for is the battery life. I don't use the pen on the Scribe unless I'm actually writing, as it drains battery quickly. When you're turning pages with the touch-screen, however, you get exceptional battery life out of the Scribe. Not so terribly much on the Paperwhite. Granted, I'm not the average reader. 30 minutes a day is amateurish. When I use the backlight all day, I'm running down the battery at least 10% on the Paperwhite, if not more. Not a deal-breaker, by any means, but gone are the days of not bringing a charging cord for a two week vacation as I did with the Scribe.

I hear a lot of people make noise about the format... AKA, the Paperwhite doesn't have the extended lip on the side like the Oasis to make it easier to hold, and that it doesn't have buttons. Well, I understand that personal preference is personal preference, but... Who the heck wants another point of mechanical failure on a device that goes through a lot of punishment in public? I don't want my precious page-turn button breaking. Ever. And, let's face it... That's why everything is touch-screen these days. Yes, you might have to clean the screen more often, or bother to wash your hands before using your precious device (which you really SHOULD be doing, anyway), but these aren't exactly deal-breakers. Another thing that's come up even in professional reviews is people ""accidentally"" activating the bottom button. The question I have is, HOW?!? You need to alter your grip for leverage to depress it, the device is so light. The only other thing I've mused on is that the Paperwhite is just a plain plastic thing. It doesn't have the flashy aluminum back-side of the Oasis or even the Scribe... It doesn't look as luxe in the hand. And honestly? After the durability and weight issues I've mentioned above, I just plain don't care. If I'm in public, my device is in a case, anyway. I'm not an Apple person. While I experience SOME e-vanity, I don't think of my Kindle as a fashion accessory. Rather the opposite, as some people judge one harshly for going with an Amazon device in the first place. I'm here to read, and you probably are too if you're bothering to read this review.

All in all, it took less than a week for the Paperwhite to become my favored reading device for its' portability, its' weight and its' utility. I love the tiny thing! I look forward to years of care-free, comfortable reading without worrying so much about dropping my favorite note-taking device and general scratch-pad, the Scribe.",4,https://www.amazon.com/gp/customer-reviews/R2N2C0JP3FPQSM,"https://images-na.ssl-images-amazon.com/images/S/amazon-avatars-global/default._CR0,0,1024,1024_SX48_.png",True,B0CFPJYX7P,2024-11-15,40.0,positive,"['life', 'love']",0.9701,electronics
124,13,B0CFPJYX7P,"All-new Amazon Kindle Paperwhite (16 GB) – Our fastest Kindle ever, with new 7"" glare-free display and weeks of battery life ",$129.99,4.2,437,https://www.amazon.com/dp/B0CFPJYX7P,"https://images-na.ssl-images-amazon.com/images/I/61MdbBO+SEL._AC_UL900_SR900,600_.jpg",349,599,R2R9HAP1I7149U,Countering Some Negative Reviews,"I am a news junky. I mostly watch TV, read newspapers, and read lots of online news websites.  I have not been a fan of reading books, but with this Kindle that is starting to change.  This makes reading easy and enjoyable.

I can only comment on my 2024 Kindle Paperwhite, but I don't see most of the issues cited in some 1-star reviews as showstoppers.  I find the ads on the cover screen are a minor inconvenience and certainly not worth spending $20 to eliminate.  The adds don't draw any power draining the battery, and they disappear as soon as you open a book to read.  Comments about a yellow tint surprise me, especially one review that included a picture that showed a definite yellow tint.  The reviewer had the warmth setting partially on, and of course, the screen had a yellow tint.  Set warmth to zero and brightness to 80% or more, and the screen background is what most people would consider paperwhite. I might turn on warmth and reduce screen brightness when reading in bed, in a dark room next to my sleeping wife, but I am very happy with the screen white color and readability.

I purchased the optional 9W charger, and it took my battery from 50 to 99% in about an hour and a half.  It is a nice charger block.  It annoys me companies no longer supply free power cubes, but even Apple stopped supplying power cubes with their iPhones.  So, it is what it is.  I didn't wait for 100% because Li batteries are stressed and take a long time to get through the last bit of charging to get to absolute 100% charge.

The Amazon branded cloth cover is very nice, maybe a bit overpriced, but you get what you pay for.  The cover color perfectly matches the color of my kindle, it is thin and lightweight, fits snuggly, and it folds back out of the way when reading.  Compared to the old cover on my 2nd gen Kindle, this this one is much less bulky.  The texture of the cover makes it less likely I will drop it on the floor.  I'm glad I went with the Amazon cover.  Make sure you are ordering the correct cover.  If you buy a 2024, 12th edition Kindle, make sure you buy the cover for the 2024 Kindle, and not the 11th edition.

A word about the trade-in offer.  I found it a bit confusing.  It said 20% off with trade-in, but when I chose the trade-in, it only appraised the value of my very old 2nd gen Kindle at $5. I assumed the 20% was a max trade-in, but they gave me 20% off plus $5.  With the black-Friday pricing, it was  a great deal.

There was an offer on the webpage of three months free Kindle Unlimited, but after I worked through the trade-in and chose the three piece bundle (Kindle, cover, and charger). the offer disappeared.  When I received and turned on my Kindle for the first time, the same offer came on the screen.  So, no harm done.  Overall, I really like the new 2024 Paperwhite.  I highly recommend it.",5,https://www.amazon.com/gp/customer-reviews/R2R9HAP1I7149U,"https://images-na.ssl-images-amazon.com/images/S/amazon-avatars-global/default._CR0,0,1024,1024_SX48_.png",True,B0CFPJYX7P,2024-11-27,35.0,positive,['great'],0.9956,electronics
125,13,B0CFPJYX7P,"All-new Amazon Kindle Paperwhite (16 GB) – Our fastest Kindle ever, with new 7"" glare-free display and weeks of battery life ",$129.99,4.2,437,https://www.amazon.com/dp/B0CFPJYX7P,"https://images-na.ssl-images-amazon.com/images/I/61MdbBO+SEL._AC_UL900_SR900,600_.jpg",349,599,R31S5SGHO7U85C,Kindle Paperwhite 12th Gen: The Ultimate E-Reader for Every Book Lover,"Title: Kindle Paperwhite 12th Gen: The Best E-Reader Just Got Better
Rating: ⭐⭐⭐⭐⭐ (5/5)

The 12th generation Kindle Paperwhite continues to cement its place as the top choice for e-readers, combining sleek design, enhanced functionality, and a user-friendly reading experience. With notable improvements from previous models, this version is ideal for both avid and casual readers.

Display & Design:
The Kindle Paperwhite 12th Gen features a 6.8-inch glare-free display, which makes reading under direct sunlight or low-light environments a breeze. The larger screen compared to previous models gives more room for text, making the reading experience feel more like a real book. The warm light adjustable settings are a welcome addition, perfect for those who enjoy reading at night without straining their eyes. Plus, it’s thin, lightweight, and portable—great for travel or cozying up at home.

Performance:
With a smoother, faster page turn experience, this Kindle delivers snappier performance than its predecessors. The extra speed is especially noticeable when flipping through books or browsing the Kindle Store. Battery life is impressive, lasting up to 10 weeks on a single charge, making it the perfect companion for long trips without needing to worry about recharging.

Waterproofing:
One of the standout features is its IPX8 waterproof rating, allowing you to comfortably read by the pool or in the bath without fear of damaging the device. This level of water resistance gives peace of mind for readers who like to take their Kindle everywhere.

Storage & Connectivity:
With 8GB or 32GB options, there’s plenty of space for thousands of books, PDFs, and audiobooks. Audiobook lovers will appreciate the seamless integration with Audible via Bluetooth headphones, making it easy to switch between reading and listening. The device also supports Wi-Fi and some versions have a cellular option, so you can download books on the go.

User Experience & Features:
Amazon’s Kindle ecosystem continues to offer useful features like Word Wise, X-Ray, and Goodreads integration. The 12th Gen Kindle Paperwhite also supports Kindle Unlimited and Prime Reading, giving access to an endless selection of books. If you’re an avid reader who enjoys highlighting, taking notes, or adjusting fonts, the Paperwhite’s intuitive interface and customizable features won’t disappoint.

Final Thoughts:
The Kindle Paperwhite 12th Gen is a solid upgrade from previous versions. It combines all the elements of a great e-reader—long battery life, a glare-free display, waterproofing, and storage options—with additional performance boosts that make reading even more enjoyable. Whether you’re reading by the beach or in bed at night, the new Kindle Paperwhite continues to be the go-to device for readers everywhere.",5,https://www.amazon.com/gp/customer-reviews/R31S5SGHO7U85C,"https://images-na.ssl-images-amazon.com/images/S/amazon-avatars-global/default._CR0,0,1024,1024_SX48_.png",True,B0CFPTK5JG,2024-10-24,80.0,positive,"['great', 'life', 'useful', 'perfect']",0.9981,electronics
126,13,B0CFPJYX7P,"All-new Amazon Kindle Paperwhite (16 GB) – Our fastest Kindle ever, with new 7"" glare-free display and weeks of battery life ",$129.99,4.2,437,https://www.amazon.com/dp/B0CFPJYX7P,"https://images-na.ssl-images-amazon.com/images/I/61MdbBO+SEL._AC_UL900_SR900,600_.jpg",349,599,R1DVYBFNKO52NU,Working wonderfully so far,"As this just came out, 4 days ago, all the reviews complaining about buttons or their kindle dying after months are just white noise about other kindle models. So lets review THIS model.

The sliding response time is slightly slower than a phones and dragging your finger fully across the screen only gives you 1 single page turn. Not ten, you won't be missing chunks of the book you are reading because you moved your finger a bit. In fact it seems to only turn the page after you slide roughly an inch either left to right.

However single taps are only slightly less sensitive than the average phone, so if you repeatedly tap left or right you'll flip through pages quickly. Make of that what you will.

The feel of the screen is lovely, in the image I tried to capture the texture of the screen using a bright light, it didn't reflect the light much so it does have that glare-free thing going for it.

The screen brightness and contrast is nice, I can't speak to what it once was but it is more slightly yellow than my phone at max white, and that helps with eye-strain, but perhaps not aesthetic for some. While I've yet to need bifocals that day is coming soon so I personally prefer the ability to read longer without discomfort.

As for longevity and battery life, again this bad boy was released on Oct 16, 2024 and today is the 20th. I can say I charged it, connect to wi-fi- and downloaded a bunch of audio-books and various books and then read 15% of a book with the brightness at half and I'm at 95% battery life, which doesn't seem bad for the amount of downloading this did.

Weighs about as much as my phone with a case on it, is easy to read at angles, is easy to navigate and quick to wake up. Wish I'd timed how fast it charged but I plugged it in a made some bread and it was charged fully from 57% when I was done.

Overall I am loving my purchase and glad I waited for the new one.",5,https://www.amazon.com/gp/customer-reviews/R1DVYBFNKO52NU,"https://images-na.ssl-images-amazon.com/images/S/amazon-avatars-global/default._CR0,0,1024,1024_SX48_.png",True,B0CFPTK5JG,2024-10-20,91.0,positive,['life'],0.9701,electronics
127,13,B0CFPJYX7P,"All-new Amazon Kindle Paperwhite (16 GB) – Our fastest Kindle ever, with new 7"" glare-free display and weeks of battery life ",$129.99,4.2,437,https://www.amazon.com/dp/B0CFPJYX7P,"https://images-na.ssl-images-amazon.com/images/I/61MdbBO+SEL._AC_UL900_SR900,600_.jpg",349,599,R1ZR5B215UBXTL,Perfect to Save Space in Bag,"I’ve been carrying around a couple books at a time lately. Finally gave in and bought this. I’ve been able to read everywhere, even the car. The bright daylight did not affect my reading. It’s so lightweight that I can have it up in front of me, compared to me trying to do that with a 600 page book. I also love the ability to purchase books through it, compared to how I had to get on the website if I was using the kindle app on my phone. I love the jade color, and I love the grip and texture. Won’t fall out of my hands. Such a great thing to have.",5,https://www.amazon.com/gp/customer-reviews/R1ZR5B215UBXTL,"https://images-na.ssl-images-amazon.com/images/S/amazon-avatars-global/default._CR0,0,1024,1024_SX48_.png",True,B0CFPHV9ZN,2024-11-10,7.0,positive,"['great', 'love']",0.9716,electronics
