Unnamed: 0,rank,asin,product_title,product_price,product_star_rating,product_num_ratings,product_url,product_photo,Total Reviews,Total Ratings,Review ID,Review Title,Review Comment,Review Star Rating,Review Link,Review Author Avatar,Is Verified Purchase,Reviewed Product ASIN,review_date,num_people_helpful,sentiment,tags,sentiment_score,category
239,24,B0CZPHPJLN,"Beats Solo 4 - Wireless Bluetooth On-Ear Headphones, Apple & Android Compatible, Up to 50 Hours of Battery Life - Slate Blue",$99.99,4.5,2595,https://www.amazon.com/dp/B0CZPHPJLN,"https://images-na.ssl-images-amazon.com/images/I/510fGxoTsTL._AC_UL900_SR900,600_.jpg",958,2889,RF2IMEN4FY4KT,Great balance between performance and affordability.,"I was looking to upgrade from my AirPods and found these headphones to be a great alternative. The ear pads are soft and comfortable, even though they’re not over-ear pads, which was a concern for me initially. They don’t cause any soreness during shorter listening sessions, but after 2-3 hours, you might start to feel some pressure and need to adjust them for better comfort.

One of the standout features is the seamless connectivity with my MacBook and iOS devices, making switching between them hassle-free. They also support Apple’s Spatial Audio, which enhances the listening experience, especially for music and movies designed for immersive sound.

While they don’t include active noise cancellation, which would have been a nice addition, the extended battery life more than compensates for it. I’ve been impressed by how long they last on a single charge, making them reliable for long workdays or travel.

Overall, these headphones strike a great balance between performance and affordability. If you’re seeking an upgrade with solid features like Spatial Audio and great battery life, these are worth considering, even without noise cancellation.",4,https://www.amazon.com/gp/customer-reviews/RF2IMEN4FY4KT,"https://images-na.ssl-images-amazon.com/images/S/amazon-avatars-global/2ee2b7a5-0f4d-469b-9104-55e1350644ca._CR0,0,441,441_SX48_.jpg",True,B0DDQLGDY3,2024-11-27,2.0,positive,"['great', 'life']",0.9918,electronics
240,25,B0DGHMNQ5Z,"Apple AirPods 4 Wireless Earbuds, Bluetooth Headphones, Personalized Spatial Audio, Sweat and Water Resistant, USB-C Charging",$119.00,4.2,548,https://www.amazon.com/dp/B0DGHMNQ5Z,"https://images-na.ssl-images-amazon.com/images/I/61iBtxCUabL._AC_UL900_SR900,600_.jpg",266,696,R3BW70XY015QM4,Great sound.. very functional,"I'm not going to be redundant on all the media reviews, but I love the sound of these. Yes, they are a little difficult to get out of the case, but only a tiny bit. They are very usable. I like the different sound options.  They stay in my ears, no problem even when walking fast. And the cost doesn't break the bank. Overall, excellent purchase  !",5,https://www.amazon.com/gp/customer-reviews/R3BW70XY015QM4,"https://images-na.ssl-images-amazon.com/images/S/amazon-avatars-global/default._CR0,0,1024,1024_SX48_.png",True,B0DGHMNQ5Z,2024-11-10,21.0,positive,['love'],0.9042,electronics
241,25,B0DGHMNQ5Z,"Apple AirPods 4 Wireless Earbuds, Bluetooth Headphones, Personalized Spatial Audio, Sweat and Water Resistant, USB-C Charging",$119.00,4.2,548,https://www.amazon.com/dp/B0DGHMNQ5Z,"https://images-na.ssl-images-amazon.com/images/I/61iBtxCUabL._AC_UL900_SR900,600_.jpg",266,696,RQ3JSZAQQ2SBY,Phenomenal!!,I had the original AirPods. I decided to upgrade to AirPods 4. Wow!! What a major difference. There’s bass and I hear more highs than I did with the 1st generation. The overall sound is incredible especially if you set up spatial audio. These AirPods fit so much better in my ears and don’t fall out. Also the case is really light. I’m enjoying listening to music and watching shows and movies so much more.,5,https://www.amazon.com/gp/customer-reviews/RQ3JSZAQQ2SBY,"https://images-na.ssl-images-amazon.com/images/S/amazon-avatars-global/default._CR0,0,1024,1024_SX48_.png",True,B0DGHMNQ5Z,2024-11-19,16.0,positive,['incredible'],0.9435,electronics
242,25,B0DGHMNQ5Z,"Apple AirPods 4 Wireless Earbuds, Bluetooth Headphones, Personalized Spatial Audio, Sweat and Water Resistant, USB-C Charging",$119.00,4.2,548,https://www.amazon.com/dp/B0DGHMNQ5Z,"https://images-na.ssl-images-amazon.com/images/I/61iBtxCUabL._AC_UL900_SR900,600_.jpg",266,696,R298S70PV3BW20,Premium sound,"As expected, these AirPods perform just as advertised. I tried Raycon and had a set of Beats Fit Pro and the sound quality of the AirPods is extremely better than the others. Before the beats I had a set of Bose sound sports and they were better than the Beats and Raycons but nothing compares to the crisp clean sound that comes from the AirPods. I was hesitant on buying the AirPods because of the price but they are well worth the price unlike the Bose sound sports. I will only use these from now on!!",5,https://www.amazon.com/gp/customer-reviews/R298S70PV3BW20,"https://images-na.ssl-images-amazon.com/images/S/amazon-avatars-global/default._CR0,0,1024,1024_SX48_.png",True,B0DGHMNQ5Z,2024-11-17,13.0,positive,[],0.8904,electronics
243,25,B0DGHMNQ5Z,"Apple AirPods 4 Wireless Earbuds, Bluetooth Headphones, Personalized Spatial Audio, Sweat and Water Resistant, USB-C Charging",$119.00,4.2,548,https://www.amazon.com/dp/B0DGHMNQ5Z,"https://images-na.ssl-images-amazon.com/images/I/61iBtxCUabL._AC_UL900_SR900,600_.jpg",266,696,R3RGPSTN0TQCUX,No charger but good airpods in general,"Really good, real airpods, nice packaging however; I did not receive a charger with theese but they just use a normal apple charger.",4,https://www.amazon.com/gp/customer-reviews/R3RGPSTN0TQCUX,"https://images-na.ssl-images-amazon.com/images/S/amazon-avatars-global/default._CR0,0,1024,1024_SX48_.png",True,B0DGHMNQ5Z,2024-11-27,4.0,positive,[],0.4582,electronics
244,25,B0DGHMNQ5Z,"Apple AirPods 4 Wireless Earbuds, Bluetooth Headphones, Personalized Spatial Audio, Sweat and Water Resistant, USB-C Charging",$119.00,4.2,548,https://www.amazon.com/dp/B0DGHMNQ5Z,"https://images-na.ssl-images-amazon.com/images/I/61iBtxCUabL._AC_UL900_SR900,600_.jpg",266,696,R10N0MQSFRIFGR,A wonderful product,"They came to me just a few days ago and I can't stop admiring them. Their sound is excellent. And amazingly the noise blocking really works. It just looks magic. They look really elegant and small, and their case is also almost as small as the AirPods 2. I also enjoy the fact that they charge with Type-C and I really recommend them.",5,https://www.amazon.com/gp/customer-reviews/R10N0MQSFRIFGR,"https://images-na.ssl-images-amazon.com/images/S/amazon-avatars-global/default._CR0,0,1024,1024_SX48_.png",True,B0DGHMNQ5Z,2024-11-16,6.0,positive,[],0.8728,electronics
245,25,B0DGHMNQ5Z,"Apple AirPods 4 Wireless Earbuds, Bluetooth Headphones, Personalized Spatial Audio, Sweat and Water Resistant, USB-C Charging",$119.00,4.2,548,https://www.amazon.com/dp/B0DGHMNQ5Z,"https://images-na.ssl-images-amazon.com/images/I/61iBtxCUabL._AC_UL900_SR900,600_.jpg",266,696,R2A566Y727KI50,Good Airpod,"at first i bought the noise cancelation one and there is few problem: the wireless charging is not very stable, and the volume is not too high even i turn to100% and i return it. Then i decided to give the regular one a try, it's much much better. Volume is not a problem anymore, without wireless charging is a down side but you know what? it's only $120, better than most of the earbuds outside. Always simple is the best, if you want to get the 4 definitely stick with the regular(without noise cancelation one).",5,https://www.amazon.com/gp/customer-reviews/R2A566Y727KI50,"https://images-na.ssl-images-amazon.com/images/S/amazon-avatars-global/default._CR0,0,1024,1024_SX48_.png",True,B0DGHMNQ5Z,2024-10-01,71.0,positive,[],0.9238,electronics
246,25,B0DGHMNQ5Z,"Apple AirPods 4 Wireless Earbuds, Bluetooth Headphones, Personalized Spatial Audio, Sweat and Water Resistant, USB-C Charging",$119.00,4.2,548,https://www.amazon.com/dp/B0DGHMNQ5Z,"https://images-na.ssl-images-amazon.com/images/I/61iBtxCUabL._AC_UL900_SR900,600_.jpg",266,696,RS72O8IFBMEEO,Better than previous versions,"The design seems to work better than Previous versions. I’ve always had an issue with them
Falling out of my ears and these seem to have a better comfort level than previous versions. They are durable and have no issue connecting to my phone.",5,https://www.amazon.com/gp/customer-reviews/RS72O8IFBMEEO,"https://images-na.ssl-images-amazon.com/images/S/amazon-avatars-global/default._CR0,0,1024,1024_SX48_.png",True,B0DGHMNQ5Z,2024-11-21,4.0,positive,['durable'],0.6705,electronics
247,25,B0DGHMNQ5Z,"Apple AirPods 4 Wireless Earbuds, Bluetooth Headphones, Personalized Spatial Audio, Sweat and Water Resistant, USB-C Charging",$119.00,4.2,548,https://www.amazon.com/dp/B0DGHMNQ5Z,"https://images-na.ssl-images-amazon.com/images/I/61iBtxCUabL._AC_UL900_SR900,600_.jpg",266,696,R2VSKKV5MY3COO,"Great Sound and Convenience, Just a Few Minor Quirks","I recently purchased the Apple AirPods 4, and overall, I’m really impressed! The sound quality is exceptional, with clear highs and rich bass that elevate my listening experience. The convenience of the wireless design makes them perfect for everyday use, whether I’m at the gym or just out for a walk.

The battery life is another standout feature; I can easily get through a full day without needing to recharge. The seamless integration with my Apple devices is also a big plus, allowing for quick pairing and easy switching between devices.

However, I do have a couple of minor complaints. The fit isn’t as snug as I would like, which can lead to them slipping out during more vigorous activities. Also, while the touch controls are handy, they can be a bit sensitive at times, leading to accidental pauses or skips.

Overall, I highly recommend the AirPods 4 for anyone looking for high-quality wireless earbuds. Just be mindful of the fit and controls, and you’ll be very happy with your purchase!",4,https://www.amazon.com/gp/customer-reviews/R2VSKKV5MY3COO,"https://images-na.ssl-images-amazon.com/images/S/amazon-avatars-global/default._CR0,0,1024,1024_SX48_.png",True,B0DGHMNQ5Z,2024-10-23,27.0,positive,"['life', 'perfect']",0.9826,electronics
248,25,B0DGHMNQ5Z,"Apple AirPods 4 Wireless Earbuds, Bluetooth Headphones, Personalized Spatial Audio, Sweat and Water Resistant, USB-C Charging",$119.00,4.2,548,https://www.amazon.com/dp/B0DGHMNQ5Z,"https://images-na.ssl-images-amazon.com/images/I/61iBtxCUabL._AC_UL900_SR900,600_.jpg",266,696,R4XHC1SSSYYVS,They fall out of your ears easily and might not work well with older Iphones,"Order these for my Iphone 10XS.  I wanted the latest generation of Earbuds to make sure down the road when I get my Iphone 17 they would work great.
Ran into 2 problems,  I had an issue with the 10XS,  the earbuds kept cutting out.  Plus they kept falling out of my ears.  When I contacted Apple about the problems, I was told the 4th edition earbuds will fit the average ear but some people have issues with them falling out.  It was suggested I purchase the Pro versions which have adapters that fit directly on them to make the fit into your ear better.  They also suggested that I update my Iphone to the latest IOS edition which I did and it made the cutoff better but not 100% gone.  Anyway,  I returned them and will look a purchasing the Pro models.
If you considering an Earbud purchase I suggest going to a place where you can actually try them in your ears to see how well they fit before you buy! I will say when they were working (and not falling out) they had great sound!",4,https://www.amazon.com/gp/customer-reviews/R4XHC1SSSYYVS,"https://images-na.ssl-images-amazon.com/images/S/amazon-avatars-global/default._CR0,0,1024,1024_SX48_.png",True,B0DGHMNQ5Z,2024-10-14,5.0,positive,['great'],0.9782,electronics
249,25,B0DGHMNQ5Z,"Apple AirPods 4 Wireless Earbuds, Bluetooth Headphones, Personalized Spatial Audio, Sweat and Water Resistant, USB-C Charging",$119.00,4.2,548,https://www.amazon.com/dp/B0DGHMNQ5Z,"https://images-na.ssl-images-amazon.com/images/I/61iBtxCUabL._AC_UL900_SR900,600_.jpg",266,696,R16K9KO7555EO0,Very Good For Price,"They fit very well, but if you keep them in for too long and your ears get really oily they tend to slip out and hurt your ears. I’ve played basketball in them on multiple occasions and have not had them slip out. In some instances i forget they are even in my ear. they sound great for the price and the case is small so it isnt bulky in your pockets. Overall a solid set of earbuds",4,https://www.amazon.com/gp/customer-reviews/R16K9KO7555EO0,"https://images-na.ssl-images-amazon.com/images/S/amazon-avatars-global/default._CR0,0,1024,1024_SX48_.png",True,B0DGHMNQ5Z,2024-11-10,6.0,positive,['great'],0.7308,electronics
250,26,B0BFC7WQ6R,"All-new Amazon Echo Spot (2024 release), Great for nightstands, offices and kitchens, Smart alarm clock with Alexa, Black",$44.99,4.6,15007,https://www.amazon.com/dp/B0BFC7WQ6R,"https://images-na.ssl-images-amazon.com/images/I/61TuF2ElKgL._AC_UL900_SR900,600_.jpg",2240,15329,R1LABVJCLQ80BV,Crisp Sound and Sleek Design,"This is my first ever owned Echo Speaker, however...

Design: I honestly fell in love with the design. I think it's very modern and the way it incorporates the clock with the speaker is very well done.

Sound: I'm honestly impressed by the sound quality. It is very loud, crisp and clear. It isn't the ABSOLUTE loudest or best speaker out there, however, it performs incredibly well. The bass very good and very present for such a small device.

Alexa: The Alexa feature on it is amazing. Very versatile with what you can do with it and it's very responsive as well. I love that you can control so many things with it if you have the right accessories.

Screen: At first glance I though the whole top portion was a screen, but it's only a small square in the center. The screen itself is very bright and pleasing to look at. Touch screen is very responsive and decently customizable, from color to clock format, but I wish it had a few more options for how you want the clock to look like, though, it's not an issue at all.

Connectivity: Very seamless and easy to handle with your phone (Alexa App). There are many options on how to use your Echo Spot and though I've only gone through a few, I've seen the rest of the things I can use the app for, and it is so versatile. I'm sure WiFi connectivity matters when it comes to response time between your phone and the Echo, but the response time was very quick in my experience.

Cord: It brings a decently long cord. Would be nice if the plug was a bit less bulky, but again, minor inconvenience, not an issue at all.

Overall, this is a solid product and I highly reccomend it if you've never had one. I did buy it with a few things in mind though. I wanted to get the most out of it, so I did order a fan and some light bulbs to control with it, and I can see myself wanting to get other things to use my Echo Spot with, however, the speaker on its own is still a great Smart Speaker/Clock.",5,https://www.amazon.com/gp/customer-reviews/R1LABVJCLQ80BV,"https://images-na.ssl-images-amazon.com/images/S/amazon-avatars-global/default._CR0,0,1024,1024_SX48_.png",True,B0BFC8DR7C,2024-09-06,74.0,positive,"['amazing', 'great', 'versatile', 'love']",0.9965,electronics
251,26,B0BFC7WQ6R,"All-new Amazon Echo Spot (2024 release), Great for nightstands, offices and kitchens, Smart alarm clock with Alexa, Black",$44.99,4.6,15007,https://www.amazon.com/dp/B0BFC7WQ6R,"https://images-na.ssl-images-amazon.com/images/I/61TuF2ElKgL._AC_UL900_SR900,600_.jpg",2240,15329,R1LOM8VZ4N5YAE,Works as Advertised,"Let me start out by saying, these things are a breeze to setup up. All you do is download the app and follow the on-screen instructions. I had no issues setting up either one of the devices I bought and they both connected to my wifi flawlessly. I love the professional looking display and voice commands work very well aswell.

Also, the sound quality on these is pretty good considering the cost. Sound quality isn't JBL Charge level good but it's definitely better than phone speakers. They are loud, clear, and even have eq settings you can set through the app. You can even set these Echos up to play music through all of your Amazon related devices at the same time which can be useful and save you a ton of money.

Prior to purchasing these gadgets, I read mixed reviews on a lot of the things I mentioned, but I haven't experienced any issues. Some of the settings can be a pain to find, but overall, the app will walk you through setup step by step what you need to do to get them working and connected to your wifi. If you have connection issues, you need to check your network settings or your wifi range.

My 2 complaints are, 1) the devices came caked in dust even though the box was sealed; and 2) the buttons could feel a little higher quality. I don't use the buttons at all due to voice commands and control through the app, but that may be an issue for some users.

Something else I noticed was the horrible reviews linking the devices to Spotify. I didn't have these reported issues myself, so they could've been fixed with a firmware update, but it's definitely worth mentioning.

I feel like a lot of these issues people are having are either network issues, or user related issues. If you take your time and follow the on-screen instructions, you won't have any issues. At the very least, my experience was great with them and yours will be too. I highly recommend this product.",5,https://www.amazon.com/gp/customer-reviews/R1LOM8VZ4N5YAE,"https://images-na.ssl-images-amazon.com/images/S/amazon-avatars-global/e5d42374-7057-4471-b95b-e1d00df5a6c4._CR0,0,1080,1080_SX48_.jpg",True,B0BFC7WQ6R,2024-09-22,68.0,positive,"['great', 'useful', 'love']",0.989,electronics
252,26,B0BFC7WQ6R,"All-new Amazon Echo Spot (2024 release), Great for nightstands, offices and kitchens, Smart alarm clock with Alexa, Black",$44.99,4.6,15007,https://www.amazon.com/dp/B0BFC7WQ6R,"https://images-na.ssl-images-amazon.com/images/I/61TuF2ElKgL._AC_UL900_SR900,600_.jpg",2240,15329,R2NEM6ANU728PW,Great bedside alarm,"Purchased this when it was on sale for $45 and would recommend waiting for a sale to snag it at that price point. $80 just seems a little high for what it is. Besides the price point, this is a great little device with a very nice-looking screen. I wanted something a bit more simplified for the bedside to not cause distractions, as I don't need to see what's new on Netflix like on an Echo Show. Of course, Alexa integration works flawlessly with my other devices and home setup. Sound is actually pretty impressive with nice bass to boot. I have this set to start my morning with my Apple Music Playlist and it works great. Very much recommend, just wait for the sales that happen a few times a year.",4,https://www.amazon.com/gp/customer-reviews/R2NEM6ANU728PW,"https://images-na.ssl-images-amazon.com/images/S/amazon-avatars-global/09a2ad25-f6c6-4e2d-8535-788b4d9a9f74._CR0,0,375,375_SX48_.jpg",True,B0BFC7WQ6R,2024-10-22,10.0,positive,['great'],0.9789,electronics
253,26,B0BFC7WQ6R,"All-new Amazon Echo Spot (2024 release), Great for nightstands, offices and kitchens, Smart alarm clock with Alexa, Black",$44.99,4.6,15007,https://www.amazon.com/dp/B0BFC7WQ6R,"https://images-na.ssl-images-amazon.com/images/I/61TuF2ElKgL._AC_UL900_SR900,600_.jpg",2240,15329,R2698A6F7SMSH8,Great Echo Device!,"*In attached picture the clock numbers look blue/teal, they aren't, that's just the way the low light in my room makes it look when I took a picture, it does not look like that in real life!

I love the quality of this, it is amazing, something you would expect from an amazon device. It is easy to use, you just talk to it and it listens (the touch screen works but i haven'tused it besides to cancel an alarm when it is going off). The sound quality is great too alot of people say the dot is so much better, I really don't notice a difference when playing 80s & 90s Country Music, it still fills the room even if it is not pointed directly at me. The display, it is great, way better than I though, it looks tiny in the pictures but in real life the screen is actually pretty large! In full light the bezel makes it look like the full upper half is a screen. I like that it shows the date, time, and weather on the screen, and how the display goes to a red at night if you have night mode enabled, it is way less bright then.

2 common complaints I don't have.

• Doesn't default to homescrewn when playing music, well it is meant for your night stand where you are 2 feet away from it, you would be able to see the small clock, if you need it to go to the home screen just say ""Alexa, go home.""
• Alarm auto snoozed, no it doesn't, just disable tap gestures, that's where the problem is. I have not yet had this happen to me and I set an alarm for 6am every morning.

This is a great device, I've had it since the beginning of October 2024, I love it! Way better than echo dot with clock! I definitely recommend it to anyone reading this!",5,https://www.amazon.com/gp/customer-reviews/R2698A6F7SMSH8,"https://images-na.ssl-images-amazon.com/images/S/amazon-avatars-global/default._CR0,0,1024,1024_SX48_.png",True,B0BFC7WQ6R,2024-10-15,24.0,positive,"['amazing', 'life', 'great', 'love']",0.9915,electronics
254,26,B0BFC7WQ6R,"All-new Amazon Echo Spot (2024 release), Great for nightstands, offices and kitchens, Smart alarm clock with Alexa, Black",$44.99,4.6,15007,https://www.amazon.com/dp/B0BFC7WQ6R,"https://images-na.ssl-images-amazon.com/images/I/61TuF2ElKgL._AC_UL900_SR900,600_.jpg",2240,15329,R1ID0PXFQLU8TF,Great little alarm clock,"I have two of these devices and am very pleased with them. They are alarm clocks but with the power of Alexa running them. I can play music to help me fall asleep and they control my smart switches. I'm not a fan of routines, but I do like a device that can answer questions or respond to requests.

These devices cannot play videos which also means they do not show ads. I get tired of Amazon showing me offers of items I just happen to mention in conversation with others (but when asked, Alexa says she doesn't spy on me, good to know). Echo Spots are compact and fit well with any counter or nightstand. I own a blue and a white Spot and I may buy another at some point when Amazon has special pricing, which typically drops the price to $44. On sale they are a very good deal and for a small device the speakers sound good, at least good enough. Settings allow me to dim the screen at night and there are several choices on how to display the time.

I'm glad Amazon came up with this design over the earlier Echo Dot with a clock, which was never easy to view. The speakers aren't as powerful as the full-size Echo, but given its compactness, it has its niche in the Echo lineup.",5,https://www.amazon.com/gp/customer-reviews/R1ID0PXFQLU8TF,"https://images-na.ssl-images-amazon.com/images/S/amazon-avatars-global/default._CR0,0,1024,1024_SX48_.png",True,B0BFC7WQ6R,2024-10-23,14.0,positive,[],0.9911,electronics
255,26,B0BFC7WQ6R,"All-new Amazon Echo Spot (2024 release), Great for nightstands, offices and kitchens, Smart alarm clock with Alexa, Black",$44.99,4.6,15007,https://www.amazon.com/dp/B0BFC7WQ6R,"https://images-na.ssl-images-amazon.com/images/I/61TuF2ElKgL._AC_UL900_SR900,600_.jpg",2240,15329,R35QOFT73OBDPL,New Echo Spot 2024 - Not just for the bedroom.,"Seems to me the marketing of this new Echo is pitched to be used in the bedroom as a modern version of the old nightstand alarm clock radio.  Which it absolutely is.  And a great version of that.  It displays a few cool versions of the clock to choose from.  It includes day/night indicator, temperature, weather icon, day, date and month.  And looks really sleek and unobtrusive.

But this little bad boy is so much more.  We use it in the family room / living room.  It’s that good looking.  The microphone is improved over previous versions, so it can hear commands clearly from across the room.  And the sound for music is phenomenal.

I got it as an upgrade from an older model and am very happy I upgraded.  Would highly recommend.",5,https://www.amazon.com/gp/customer-reviews/R35QOFT73OBDPL,"https://images-na.ssl-images-amazon.com/images/S/amazon-avatars-global/default._CR0,0,1024,1024_SX48_.png",True,B0BFCBKXWL,2024-11-07,24.0,positive,['great'],0.964,electronics
256,26,B0BFC7WQ6R,"All-new Amazon Echo Spot (2024 release), Great for nightstands, offices and kitchens, Smart alarm clock with Alexa, Black",$44.99,4.6,15007,https://www.amazon.com/dp/B0BFC7WQ6R,"https://images-na.ssl-images-amazon.com/images/I/61TuF2ElKgL._AC_UL900_SR900,600_.jpg",2240,15329,R24NI6OLHKOTHM,Great Alarm Clock and Echo speaker Combo,"Our (not smart) radio alarm clocks were acting up. Picked up 3 of these on sale during Prime Days. They work great. Setup alarms to a local radio station (online radio streaming only) and works with smart light switch and can auto turn on lights in morning when alarm goes off. Its sound quality is close to Echo Dot. There is no ads. (Purchased Echo Show 5 originally, and they force ads). It shows Clock, weather, and/or date all the time. This also works great in kids room, to make sure they don't turn off their alarms, as you can check with the Alexa app on your phone. There is no way of locking the clock, but you can change Alexa trigger word and turn off the mic.",5,https://www.amazon.com/gp/customer-reviews/R24NI6OLHKOTHM,"https://images-na.ssl-images-amazon.com/images/S/amazon-avatars-global/default._CR0,0,1024,1024_SX48_.png",True,B0BFC7WQ6R,2024-10-25,4.0,positive,['great'],0.2263,electronics
