Unnamed: 0,rank,asin,product_title,product_price,product_star_rating,product_num_ratings,product_url,product_photo,Total Reviews,Total Ratings,Review ID,Review Title,Review Comment,Review Star Rating,Review Link,Review Author Avatar,Is Verified Purchase,Reviewed Product ASIN,review_date,num_people_helpful,sentiment,tags,sentiment_score,category
0,1,B0D1XD1ZV3,"Apple AirPods Pro 2 Wireless Earbuds, Active Noise Cancellation, Hearing Aid Feature, Bluetooth Headphones, Transparency, Per",$169.99,4.6,10774,https://www.amazon.com/dp/B0D1XD1ZV3,"https://images-na.ssl-images-amazon.com/images/I/61SUj2aKoEL._AC_UL900_SR900,600_.jpg",2820,11449,RB47WOU0Q32Y5,"AirPods Pro 2: Subtle Upgrades, Major Impact for Everyday Users","I've owned multiple pairs of AirPods over the years—standard, Pro, and even the Max version. Up until now, my favorite had always been the first-generation AirPods Pro. But after debating whether or not to get the second-generation AirPods Pro, I finally took the plunge, and I’m glad I did. Here’s what I’ve noticed after using them.

The biggest improvement I noticed right away was the noise cancellation. I spend a lot of time in loud environments, whether it's in a workshop or just crowded spaces, and the V2’s ANC works much better at filtering out background noise. There’s also this new feature where it seems to adjust based on voices around you, something that wasn’t in the first version. It’s made a noticeable difference when I need to focus or block out distractions.

In terms of sound, I wouldn’t say it’s a night-and-day difference, but the bass feels more punchy in this new version. The sound is crisper overall, but unless you’re really paying attention, the upgrade might seem subtle.

One of the best things about the AirPods Pro (V2) is the improvement in battery life. I’m getting almost double the usage time compared to the first-gen. Plus, Apple finally switched to USB-C charging, which feels long overdue. The wireless charging has also been more reliable—no more overheating or endless charging cycles like I had with the older model.

Something I always look for in Apple products is quality, and I’m happy to report that it’s still there. These AirPods feel sturdy, and they work flawlessly with my other Apple devices. Pairing them is almost instant, and the upgraded FindMy feature has been a lifesaver. The fact that the charging case can now make a noise when lost is incredibly useful—something the previous model didn’t offer, which was a frustrating limitation.

AppleCare+ remains as good as ever, and I continue to recommend it for all Apple products. This time around, they’ve made it simpler by offering an option to bundle it directly with the purchase, so you don’t have to activate it later on. It saves you the hassle, and it ensures that you're covered from day one.

For me, the most crucial factor is how much I use these. I wear my AirPods a lot—whether I’m listening to music or just using them for noise cancellation during daily tasks. If you’re like me and have these in your ears for hours on end, the V2 is absolutely worth the upgrade. But if you’re not using them constantly, you might want to hold off for the next version that’s likely coming soon.

In conclusion, while the second-generation AirPods Pro might not be a massive leap in sound quality for the average listener, the combination of better noise cancellation, battery life, and new features make it a solid upgrade. For regular users like me, it's definitely worth the investment, but casual users might be just fine sticking with their current pair.",5,https://www.amazon.com/gp/customer-reviews/RB47WOU0Q32Y5,"https://images-na.ssl-images-amazon.com/images/S/amazon-avatars-global/24eff174-2462-428d-a5b4-22497ef5d2c0._CR0,0,375,375_SX48_.jpg",True,B0D1XD1ZV3,2024-09-27,793.0,positive,['life'],0.9955,electronics
1,1,B0D1XD1ZV3,"Apple AirPods Pro 2 Wireless Earbuds, Active Noise Cancellation, Hearing Aid Feature, Bluetooth Headphones, Transparency, Per",$169.99,4.6,10774,https://www.amazon.com/dp/B0D1XD1ZV3,"https://images-na.ssl-images-amazon.com/images/I/61SUj2aKoEL._AC_UL900_SR900,600_.jpg",2820,11449,R3PZ8SJ4QVNLQO,Nicest headset out there!,"Dear Apple,

You made a great pair of headphones. The clarity is superb, the noise cancellation can be used for any task (that requires some ear protection like shooting at a gun range, for example), the fact you can nod your head to answer a call or shake your head to reject a call, the battery life, the fit, everything is so nicely made. My favorite feature is the head movement to answer or deny a call. I am not sure how they achieved this but I am very happy with it to be honest. I thought it was a gimmick and it would never work but it works perfectly on my 16Pro. I came from a set of Beats earbuds and they didn’t have this feature and they’re made by Apple as well. I think I will get one for my dad because he’s always wanted one. This is by far the best earbuds for the price. Thanks again Apple!",5,https://www.amazon.com/gp/customer-reviews/R3PZ8SJ4QVNLQO,"https://images-na.ssl-images-amazon.com/images/S/amazon-avatars-global/default._CR0,0,1024,1024_SX48_.png",True,B0D1XD1ZV3,2024-11-20,37.0,positive,"['great', 'life']",0.9905,electronics
2,1,B0D1XD1ZV3,"Apple AirPods Pro 2 Wireless Earbuds, Active Noise Cancellation, Hearing Aid Feature, Bluetooth Headphones, Transparency, Per",$169.99,4.6,10774,https://www.amazon.com/dp/B0D1XD1ZV3,"https://images-na.ssl-images-amazon.com/images/I/61SUj2aKoEL._AC_UL900_SR900,600_.jpg",2820,11449,R3H55DLDY8DCXL,READ BEFORE PURCHASE! 😊,"First, please comment if you have any questions and I would love to respond to help!

I had the AirPods Pro Gen1 prior to these, but the new AirPods blew them out of the water. The added ear tips make customability even better especially for small ears like mine.

The Active Noise Cancellation is clearly superior to the first generation and the addition of Adaptive audio is super cool and very useful.

The battery is even better than I was expecting. The AirPods charge super fast in the case, and the case charging itself is also super fast. The USB-C cord is a very nice addition especially with the new, more common, USB-C charging block. The new Apple Braided USB-C cord is also a small but nice touch.

I personally do not use the ring on the side, but I imagine many people may find it useful. The addition of the Find My capabilities with both the case and the AirPods themselves is beyond helpful because I always seem to misplace them. Small bonus, every time you charge the case or the AirPods, the case sounds off a little chime to let you know that they are charging or if the battery is low.

As an owner of the AirPods Max and a former owner of the AirPods Pro gen 1, I would 100% recommend this new generation. The noise cancellation is superior to the gen 1, but slightly behind the Maxes because they are in-ear instead of over-ear. If you want the maxes, I would get them, but it depends on your activities. I have noticed recently how good the sound quality is. It’s stunning. Sometimes I still prefer my Maxes for certain listening experiences or if I’m heavily invested in a movie or I have a long flight, but the quality on the 2nd gen pros is so crisp. Some pitches you can notice are superior to that of the Maxes. In terms of listen, Maxes win, but it’s so damn close. AirPods Pro are ideal because they are small, discrete, and light weight. You can slip them in your pocket or place just one in your ear. They are also very useful and comfortable to use while working out, as opposed to the maxes.

The AirPods are quite durable too. If my first pair is any indication to this pair, then I promise you, they can take a beating. After 4 years of having the first gen AirPods Pro, I have thrown them around, dropped them hundreds of times and they often got small scratches, but only chipped once or twice after higher falls on super hard surfaces. But they worked every single time.

Long story short, if you’re on the fence, get them. They are super great for travel, workouts/runs, house chores, and all activities in general.

Hope you find this helpful, if you have any questions please comment them!",5,https://www.amazon.com/gp/customer-reviews/R3H55DLDY8DCXL,"https://images-na.ssl-images-amazon.com/images/S/amazon-avatars-global/default._CR0,0,1024,1024_SX48_.png",True,B0D1XD1ZV3,2024-08-09,1.0,positive,"['great', 'useful', 'love', 'durable']",0.9992,electronics
3,1,B0D1XD1ZV3,"Apple AirPods Pro 2 Wireless Earbuds, Active Noise Cancellation, Hearing Aid Feature, Bluetooth Headphones, Transparency, Per",$169.99,4.6,10774,https://www.amazon.com/dp/B0D1XD1ZV3,"https://images-na.ssl-images-amazon.com/images/I/61SUj2aKoEL._AC_UL900_SR900,600_.jpg",2820,11449,R26UEFEPMZFOEW,These are fantastic! First pair of AirPods. I use the hearing aid functionality,"A couple months ago I got “commercial” hearing aids from the VA. However, I didn’t like how they operated so I gave them back, and they’re going to order a different brand/model, which I’ll have in about three months (!) So I went in search of quality, inexpensive hearing aids to fill the gap. (My hearing loss is considered mild, at -32db on one side and -39db on the other.) I got the AirPods last Friday, and the software for hearing aid support rolled out last night (iOS 18.1) So this will be a two part review.

Part one is the overall operation as earbuds for music and calls. These are my first ever Apple branded sound devices. Once I got the correct tips installed and the buds fitted, I was ready to go. OMG! The sound quality overall is the best of any earbuds I’ve ever owned, and by a huge margin. Astonishing bass, and crisp high range. (My hearing loss is in the upper ranges.) I’m beyond happy. Overall, the only thing I’m dissatisfied with is the battery life at 5-6 hours, but the extremely fast recharge speed eases that compliant. Voice quality when on a call is crystal clear. Controls are easy, though a bit hard to operate considering how small they are.

Part two is the hearing aid function. The first thing I had to do was take a hearing test with the included software. (However, if you prefer to use a third party hearing test, you can import that profile and use it.) The hearing test takes about 5 minutes, after which the hearing aid sound enhancement profile is set automatically and they start up. I was totally gobsmacked at how well these things work! They boost the exact freqs I need. They actually work considerably better than those $7000 (egads!) hearing aids that I returned.

Now for the ANC. At home, I sit right in front of a large, noisy window air conditioner. On the opposite side of the room is a dehumidifier (I live in south central Texas, where it was 91° yesterday.) Between these two pieces of equipment, it’s pretty noisy here. I turned on ANC and the room went absolutely silent. So silent that I thought I’d popped a circuit breaker and everything had stopped running. I removed one of the AirPods, and the noise returned. Amazing.

In short, everything I’d hoped the commercial hearing aids would do, the AirPods actually DID. I consider this the smartest purchase I’ve made in years. Only one negative, and that’s the ear tips. None of the provided sizes are a good fit for me, so I’m now looking to memory foam replacements. But that’s a very small gripe. If you’re looking at these, either for music or hearing, don’t hesitate. You’ll be glad you got them.

EDIT: I had to go to a doctor appointment across town today. Part of the route is on a toll highway with an 80 mph speed limit and heavy traffic. I got up to speed and turned on noise cancel mode.  INSTANTLY the car was completely silent at 80 mph. No road rumble, no engine noise, no wind noise, no traffic noise. It was an amazing and invigorating experience.  Oh, for those wondering about recharge time, if you take them all the way down to 0% battery and they shut down (I’ve now ascertained that 6 hours is about what you get with all the options turned on), it only takes about 15 minutes in the charge case and you’ll easily get another 3-4 hours out of them.

EDIT2: Okay, I’ve had these for almost a month, and I just keep liking them more and more. I didn’t mention pairing in my original text above, so I need to mention it here. There is, in effect, no pairing that you need to do, at least in the Apple-verse. By the time I’d opened the charging case and looked at the buds, they’d already paired with both my iPhone and iPad. I didn’t have to go into settings on my iOS devices, or press any buttons on the case. Just open case and it’s done. As a computer engineer for 40 years, I have never seen a faster or more seamless pairing of anything.

One more word on recharging: just today I took them all the way to zero. Dropped them in the charger and in FIVE MINUTES they were at 24%.

I am in love with the hearing aid functionality. I hear sounds in movies that I’d never heard before in my life, even when my hearing was perfect. And I can adjust amplification either by going into settings on my iPhone, or sliding my finger up or down on the stem.",5,https://www.amazon.com/gp/customer-reviews/R26UEFEPMZFOEW,"https://images-na.ssl-images-amazon.com/images/S/amazon-avatars-global/default._CR0,0,1024,1024_SX48_.png",True,B0D1XD1ZV3,2024-10-29,327.0,positive,"['amazing', 'life', 'perfect', 'love']",0.9968,electronics
4,1,B0D1XD1ZV3,"Apple AirPods Pro 2 Wireless Earbuds, Active Noise Cancellation, Hearing Aid Feature, Bluetooth Headphones, Transparency, Per",$169.99,4.6,10774,https://www.amazon.com/dp/B0D1XD1ZV3,"https://images-na.ssl-images-amazon.com/images/I/61SUj2aKoEL._AC_UL900_SR900,600_.jpg",2820,11449,R1TJTYKID5K0C,You must buy these their perfect,"I’ve had these AirPods for almost 2 years and let me say that they are the best purchase you will ever make. I’ve never written a review but I had to because of how magnificent these are. The noice cancelling is amazing, for my first test I sat in a chair playing loud music turned away from a piano. I sat and waited, then took one out to tell her to start playing. To my astonishment she had been playing for a while and I didn’t even notice. The transparency mode is amazing as well because you’ll often forget there even in your ears because it plays the sound so well. You can even hear the slightest brush of your fingers it’s like there not even in. They are extremely comfortable and fit perfectly in your ears. They hardly weigh anything but they still have amazing battery life. They are extremely durable and water resistant as well. I had one in my pocket and as I went to get the mail it fell out. An hour later after searching and searching I found it in the road in the snow with tire tracks right over it practically burying it. It took it home thinking it would be completely ruined, but besides worse noice cancelling and a big scratch on the side (which is only cosmetic damage) it works perfectly. And don’t even get me started on the audio quality. I have high quality head phones and these AirPods Pro 2 blow them out of the water and they are extremely portable. The precision find my is also so nice because it also doubles as an AirTag. I put them on my keys and haven’t lost them since. Seriously the best product I’ve ever purchased because I use them hours daily. The only possible downside I could even think of is if you have very large ears, they may not fit great since the tips only go to extra large. Also don’t buy apple care plus. It’s a scam because they are literally indestructible and impossible to lose. Best $250 dollars ever spent would give 10 stars if possible. Seriously besides my phone, which I use to connect with my AirPods, there is nothing I use more than these AirPod pros. Also I exercise in them all the time and unless intentionally trying to knock them out, they’ve never fallen out. Oh yeah and also they are perfect for taking calls as well. And they fit perfectly into the overpriced apple ecosystem.",5,https://www.amazon.com/gp/customer-reviews/R1TJTYKID5K0C,"https://images-na.ssl-images-amazon.com/images/S/amazon-avatars-global/default._CR0,0,1024,1024_SX48_.png",True,B0D1XD1ZV3,2024-11-27,5.0,positive,"['perfect', 'amazing', 'great', 'life', 'durable']",0.9978,electronics
5,1,B0D1XD1ZV3,"Apple AirPods Pro 2 Wireless Earbuds, Active Noise Cancellation, Hearing Aid Feature, Bluetooth Headphones, Transparency, Per",$169.99,4.6,10774,https://www.amazon.com/dp/B0D1XD1ZV3,"https://images-na.ssl-images-amazon.com/images/I/61SUj2aKoEL._AC_UL900_SR900,600_.jpg",2820,11449,R3MQ4VFS4YGPCR,I like it,"I recently purchased the Apple AirPods Pro, and they’ve quickly become my favorite tech accessory. The noise cancellation is incredibly effective, creating a truly immersive sound experience that drowns out background noise, making it great for work or travel. The transparency mode is also a fantastic feature, allowing me to hear my surroundings when needed without having to take them off.

The sound quality is impressive, with a balanced bass and clear mids and highs that work well for various music genres. The fit is comfortable and secure, even during workouts, thanks to the customizable silicone tips. They also come with sweat and water resistance, making them suitable for the gym or outdoor activities.

Battery life is solid, and I love the convenience of wireless charging with the case. The integration with the Apple ecosystem is seamless—switching between my iPhone, iPad, and Mac is effortless.

Overall, the AirPods Pro are a bit pricey, but the quality, features, and ease of use make them worth it if you’re invested in the Apple ecosystem. They’ve genuinely upgraded my audio experience!",5,https://www.amazon.com/gp/customer-reviews/R3MQ4VFS4YGPCR,"https://images-na.ssl-images-amazon.com/images/S/amazon-avatars-global/default._CR0,0,1024,1024_SX48_.png",True,B0D1XD1ZV3,2024-11-12,25.0,positive,"['great', 'love', 'life']",0.9767,electronics
6,1,B0D1XD1ZV3,"Apple AirPods Pro 2 Wireless Earbuds, Active Noise Cancellation, Hearing Aid Feature, Bluetooth Headphones, Transparency, Per",$169.99,4.6,10774,https://www.amazon.com/dp/B0D1XD1ZV3,"https://images-na.ssl-images-amazon.com/images/I/61SUj2aKoEL._AC_UL900_SR900,600_.jpg",2820,11449,R33I973QQCOZUK,Impressive Performance with a Few Drawbacks,"The Apple AirPods Pro 2 truly elevate the listening experience, especially with their impressive noise cancellation and adaptive audio features. The sound quality is crisp, with enhanced bass and clarity that makes music and calls enjoyable. I also love the convenience of the USB-C charging and the quick pairing with Apple devices, which is seamless as expected. The added hearing aid mode is a great bonus and works well for ambient sound clarity.

However, there are a couple of limitations worth noting. First, the battery life could be better—lasting about six hours per charge, which requires recharging in the middle of the day if you use them continuously. Additionally, although the silicone ear tips come in multiple sizes, they don’t always provide a perfect fit for everyone. For longer listening sessions, the fit can feel slightly uncomfortable, especially when moving around or working out.

Overall, they are a worthwhile upgrade, especially for Apple users, but there's some room for improvement to make them perfect for all-day wear.",4,https://www.amazon.com/gp/customer-reviews/R33I973QQCOZUK,"https://images-na.ssl-images-amazon.com/images/S/amazon-avatars-global/default._CR0,0,1024,1024_SX48_.png",True,B0D1XD1ZV3,2024-11-11,24.0,positive,"['great', 'perfect', 'love', 'life']",0.9822,electronics
7,1,B0D1XD1ZV3,"Apple AirPods Pro 2 Wireless Earbuds, Active Noise Cancellation, Hearing Aid Feature, Bluetooth Headphones, Transparency, Per",$169.99,4.6,10774,https://www.amazon.com/dp/B0D1XD1ZV3,"https://images-na.ssl-images-amazon.com/images/I/61SUj2aKoEL._AC_UL900_SR900,600_.jpg",2820,11449,R3TBZSBB33HSDZ,Amazing Sound and Features!,"The second generation is absolutely worth it! The noise cancellation is top-notch, and the personalized spatial audio makes music and calls sound incredible. I love the seamless pairing with my devices and the new USB-C charging option. The hearing aid feature and transparency mode are thoughtful additions that truly enhance the experience. A great upgrade from the first generation  These earbuds are a perfect blend of comfort, quality, and functionality. Highly recommend!",5,https://www.amazon.com/gp/customer-reviews/R3TBZSBB33HSDZ,"https://images-na.ssl-images-amazon.com/images/S/amazon-avatars-global/37051f5d-3a70-4d13-8e9d-b05d739ae5fc._CR328,0,844,844_SX48_.jpg",True,B0D1XD1ZV3,2024-11-27,2.0,positive,"['incredible', 'great', 'perfect', 'love']",0.9766,electronics
8,1,B0D1XD1ZV3,"Apple AirPods Pro 2 Wireless Earbuds, Active Noise Cancellation, Hearing Aid Feature, Bluetooth Headphones, Transparency, Per",$169.99,4.6,10774,https://www.amazon.com/dp/B0D1XD1ZV3,"https://images-na.ssl-images-amazon.com/images/I/61SUj2aKoEL._AC_UL900_SR900,600_.jpg",2820,11449,RDZLQ7XHX7K91,"Big Improvement over 1st Gen, not so sure they are hearing aids","I was fairly satisfied with my first generation AirPods Pro, having bought them several years ago mostly for use when working out. When Apple announced the addition of hearing aids features, I thought it was a good excuse to upgrade. And it would be one less lightning connector I'd have to contend with. This review is written for those of you who are considering upgrading.

I bought these prior to the release of iOS 18.1. The setup was the same as before, find comfortable rubbers, run the test that plays the little tune and that's it. With iOS 18.0 the sound didn't seem much better over Gen 1 AirPods Pro, but the noise cancellation was an improvement. However, with the update to 18.1 there's a big change. There's now a hearing assistance screen where you toggle on hearing aids. You're prompted to take a hearing test. This test is similar to hearing tests you might have had in school or at a doctors' office where tones of differing pitch and loudness are played and you tap a button on the screen when you hear it. It takes about 10 minutes or so. The phone/earbuds then produce a profile based on your test results. You can also take the report to an audiologist (the report is in the Health app), although I'm not all that sure they'd bother to review it.

Once you've done a hearing test the hearing aid is enabled. You can then make adjustments to the default settings. I found the default setting to have far too much high end for my liking and too much gain as well. But then again maybe I'm just used to being half-deaf. 😉 I did discover I have a device with a bad fan though, so maybe that's a good thing. I don't seem to get any squealing or feedback when using the hearing aid feature but I've only used it a few times. It did come in handy when at a meeting with a quiet talker speaking, boosting up the sound made it much easier to listen. But ultimately I'd say the hearing aid function is a gimmick. If you're really worried about hearing loss, go to an audiologist.

However, there is one thing that going through the hearing test and setting up hearing assistance does improve and that's the playback of music. Because it is able to adjust EQ to match your hearing profile there's a drastic improvement in how good the AirPods sound. I'd put them on par with my Bose QC-3 headset now, maybe even slightly better (Bose still has much better noise cancellation of course). Adaptive noise cancellation works but tends to be little too aggressive, so I just use full cancellation. The personalized volume and conversation awareness functions are also a little too touchy and seem to be constantly changing the volume control in response to false alarms. I'm sure they'll get better over time but for now I wouldn't say they're a reason to switch.

They also have the same problems connecting to whatever random device happens to grab them. I work out with my Watch but leave my phone at home. So if I start playing a podcast or music in my driveway it will originate from my iPhone, even if I'm using my watch to initiate the media. It is getting slightly better in that eventually the AirPods will abandon the iPhone then connect to the Watch (I used to have to pull them out of my ears, wait a few seconds then try to start playback on the watch), but there's still a gap of a few annoying seconds while they sort things out. Again, not the end of the world, but seems like a solvable problem.

If you're hoping to get budget hearing aids, look elsewhere. I can't imagine wearing these for 12-16 hours a day. I'm not so sure the batteries will last that long anyway. Besides, you're wearing earbuds, so people probably won't realize you're using them in hearing aid mode. And let's all admit it, they look kind of dorky.",4,https://www.amazon.com/gp/customer-reviews/RDZLQ7XHX7K91,"https://images-na.ssl-images-amazon.com/images/S/amazon-avatars-global/default._CR0,0,1024,1024_SX48_.png",True,B0D1XD1ZV3,2024-11-20,11.0,positive,[],0.7324,electronics
