Unnamed: 0,rank,asin,product_title,product_price,product_star_rating,product_num_ratings,product_url,product_photo,Total Reviews,Total Ratings,Review ID,Review Title,Review Comment,Review Star Rating,Review Link,Review Author Avatar,Is Verified Purchase,Reviewed Product ASIN,review_date,num_people_helpful,sentiment,tags,sentiment_score,category
354,36,B09ZX1LRXX,"Amazon Echo Pop (newest model), Our smallest Alexa speaker, Just right for bathrooms, dens and other small spaces, Midnight T",$17.99,4.7,69855,https://www.amazon.com/dp/B09ZX1LRXX,"https://images-na.ssl-images-amazon.com/images/I/71pEY++5qXL._AC_UL900_SR900,600_.jpg",7378,70289,RYBK0F6WD4SQA,"Great, hope new features are added","As a college student, this smart speaker is incredibly helpful for managing my busy schedule. The Echo Pop is more compact and affordable than other Echos. It fits easily in my dorm and is easy to pack when moving between home and school.

Favorite features:
It reads my Google Calendar events to me, and I set personalized wake-up, evening, and unwind routines so that I have the external motivation to do what I need to do at the right times. I also like that I can set multiple timers/reminders without having to go on my phone, so it feels like I have a personal assistant.
I think the audio quality is pretty good as well, and I can pull-up my Spotify playlists (although if you give your playlists some complicated long name, it can be a bit harder). I usually just like to get Alexa to pull up the specific song or artist I feel like listening to at the moment and loop it though.

Improvement:
Because of school I use both Apple & Google products , and it's a bit frustrating not to be able to directly sync Alexa better with the Apple ecosystem. While it reads Google Calendar events, I'd like if Alexa could also see, create, and remind me of my Google Tasks, or do this with Apple Reminders. Currently, you'd have to check the Alexa app for notes that you create with Alexa, and there are no helpful widgets or syncing tools that work well for making this information more accessible.

Also I think the routines feature could be more flexible. Currently, if you want routines to activate at different times on weekdays versus weekends, you have to manually copy and create new routines, but I don't want the extra clutter.

Some other considerations:
Note that the Echo Pop needs to be plugged in at all times to function, so it requires setup every time you move it to a different room. I recommend getting a battery base if you want the flexibility to move it around, such as taking it to a common room or for listening to music while showering.

Overall, it has still added a lot of structure to my days, so I'd recommend it!",5,https://www.amazon.com/gp/customer-reviews/RYBK0F6WD4SQA,"https://images-na.ssl-images-amazon.com/images/S/amazon-avatars-global/default._CR0,0,1024,1024_SX48_.png",True,B09ZXJDSL5,2024-07-30,109.0,positive,[],0.9872,electronics
355,36,B09ZX1LRXX,"Amazon Echo Pop (newest model), Our smallest Alexa speaker, Just right for bathrooms, dens and other small spaces, Midnight T",$17.99,4.7,69855,https://www.amazon.com/dp/B09ZX1LRXX,"https://images-na.ssl-images-amazon.com/images/I/71pEY++5qXL._AC_UL900_SR900,600_.jpg",7378,70289,R1380EU5W13YG5,Nice,"This product is perfect for listening to music at low volume, but when you turn up too much, it starts to sound weird. But the product is very good and nice looking. The price was reasonable enough.",5,https://www.amazon.com/gp/customer-reviews/R1380EU5W13YG5,"https://images-na.ssl-images-amazon.com/images/S/amazon-avatars-global/default._CR0,0,1024,1024_SX48_.png",True,B09ZXLRRHY,2024-11-15,6.0,positive,['perfect'],0.8456,electronics
356,36,B09ZX1LRXX,"Amazon Echo Pop (newest model), Our smallest Alexa speaker, Just right for bathrooms, dens and other small spaces, Midnight T",$17.99,4.7,69855,https://www.amazon.com/dp/B09ZX1LRXX,"https://images-na.ssl-images-amazon.com/images/I/71pEY++5qXL._AC_UL900_SR900,600_.jpg",7378,70289,RXV67S19Q3A5J,Very easy to use,It was super easy to pair and use with my phone and also connects easily with all other Alexa items I have around the house. It's very knowledgeable and can answer questions in no time. Has a good speaker system aswell so if you want to play music in your room or whereever you have it it's a good go. The voice recognition is instantly aswell but also has a button on it if you want to turn off the mic you can. Overall a really good product and a really good entry product to the Amazon Echo series.,5,https://www.amazon.com/gp/customer-reviews/RXV67S19Q3A5J,"https://images-na.ssl-images-amazon.com/images/S/amazon-avatars-global/default._CR0,0,1024,1024_SX48_.png",True,B09ZX1LRXX,2024-11-15,6.0,positive,[],0.9582,electronics
357,36,B09ZX1LRXX,"Amazon Echo Pop (newest model), Our smallest Alexa speaker, Just right for bathrooms, dens and other small spaces, Midnight T",$17.99,4.7,69855,https://www.amazon.com/dp/B09ZX1LRXX,"https://images-na.ssl-images-amazon.com/images/I/71pEY++5qXL._AC_UL900_SR900,600_.jpg",7378,70289,R2JT631M77O9UK,Love,"Such a great powerful device, easy to hook up, great color. Got it until I could upgrade to an echo show. Sound great, wonderful.",5,https://www.amazon.com/gp/customer-reviews/R2JT631M77O9UK,"https://images-na.ssl-images-amazon.com/images/S/amazon-avatars-global/2242a42a-88fd-4c18-ae7b-8bdd5d716ad8._CR0,0,379,379_SX48_.jpg",True,B09ZX1LRXX,2024-11-27,2.0,positive,['great'],0.9709,electronics
358,36,B09ZX1LRXX,"Amazon Echo Pop (newest model), Our smallest Alexa speaker, Just right for bathrooms, dens and other small spaces, Midnight T",$17.99,4.7,69855,https://www.amazon.com/dp/B09ZX1LRXX,"https://images-na.ssl-images-amazon.com/images/I/71pEY++5qXL._AC_UL900_SR900,600_.jpg",7378,70289,R3DT0XP2KQQV51,Amazing Sound at a Low Price,"The Amazon Echo Pop was my first experience with an Alexa device, and I could kick myself for not buying 2 of these at the sale price of just under $23. At that price, these little smart speakers are well worth it. However, at the list price, you might do better to spend another $10 and go for the Echo Dot. Better still, if you can pick up an Echo Gen4 as certified refurbished, then that is quite a good deal at around $50.

Prior to purchasing the Echo Pop, I installed the Alexa App on my iPhone, and during order time, I did the pre-configuration. Upon arrival, the setup was a breeze, and in a matter of just a few minutes I was greeted by a pleasant sounding female voice. The audio quality of this little speaker was amazing. I asked it a few questions, then said “Alexa, play Peaceful Current Radio.” It was a truly Hi-Fidelity experience, even though it was monophonic. On that station, a great deal of the music is solo acoustic, so stereo , 3D, or surround sound isn’t necessary to hear the clear and faithful reproduction of a piano, guitar, or cello. The bass from this speaker isn’t going to rattle the walls, but the little speaker was able to fill my master bedroom with beautiful music, that sounded like the instruments were in the same room.

That should cover the good points about this smart device. I rarely give any product 5 stars, but if I could give it a rating of 4.5 I would, primarily because of what it can do at such a low sell price. There are some issues that you might want to consider if you are looking for a good Echo Device. It is far from perfect. Its smarts are at the low end, and a good Wi-Fi connection is needed if you want a fast response. It can’t function as a hub, so if you want to control various smart devices in your home, you will likely need an Echo Gen4 or better. It doesn’t have a 3.5 mm audio jack, so if you want to connect to headphones or external speakers, you will need to use Bluetooth. The Bluetooth connection can be tricky, but once you pair with speakers, it quickly disconnects and reconnects by just turning off the speakers and turning them back on. I also found out that after doing this several times, it began to experience streaming problems, and I had to unplug it and plug it back in to fix the problem.

Bluetooth streaming seems to suffer a bit in fidelity. I paired it with some Logitech Bluetooth computer speakers, and even though it produced stereo sound, the frequency response was not as good, and the stereo separation was weak. Some of this was likely due to the Logitech speakers. They aren’t exactly the best computer speakers and I am not too fond of the passive radiator design that gives the base an unnatural sound.

I tried a separate GT Bluetooth to 3.5 mm adaptor, which I connected to my retro audio system, and the sound quality was a little better, but I had to crank the volume knob up pretty high. When I connected the Bluetooth adaptor to wired headphones it sounded pretty good, so using Bluetooth headphones seems a good alternative listening method.

One other issue is with the alarm level. I can’t seem to set it to a level that will override the music, and alert me that it’s time to take medications or walk the dog. It usually takes me awhile to realize that it is sounding a wake-up. It is loud enough when not playing music, but too low of a level when music is playing.

Overall, it is a very good device, and its small size makes it easy to place in an out of the way location, such as in the kitchen or bathroom. It has great sounding audio that can fill a small room, but not quite good enough to fill a large family or living room. It really shines at playing relaxing music such as from an Internet radio station such as “Peaceful Current Radio,” or other similar music stations. However, for Rock- and Roll or party music, you will likely want something with a little more punch.

Update:
I just had to do a follow up to my previous review. I caught a sell and picked up another Echo Pop for just under $20. That means I acquired 2 of these for around $45 with tax. They make a great stereo pair. Two speakers are better than one. You get double the sound. This means a great improvement in the base response. With 2 drivers pushing the air, they do a better job. I just tweak the bass response 2 notches, and the treble 1 notch, and these rival the audio quality of my much larger and more expensive JBL studio monitor bookshelf speakers with a 100 watt per channel amplifier pushing them. Of course they can’t match the power, but 2 of these in a stereo pair can do a pretty good job in my 13 by 13 master bedroom with vaulted ceiling. I’m considering adding an Echo Sub hidden away under my bed.

Alexa does a much better job at finding my favorite Internet radio stations as well. Siri keeps telling me she can’t find that in my Apple music library.

I have a database of URLs to over 9000 radio stations. Alexa easily finds most of my favorites such as:
Peaceful current Radio
New Standard WNYC
IPR Studio 1
KTUX FM
KSRY FM
WJIB FM
Café Del Mar Radio
Americana Boogey Radio
Aloha Joe
Quiet Village Radio
WSBZ FM
Smooth Jazz 101
WABE Classical

Just ask Alexa to play any of these, and get ready for a treat.",4,https://www.amazon.com/gp/customer-reviews/R3DT0XP2KQQV51,"https://images-na.ssl-images-amazon.com/images/S/amazon-avatars-global/default._CR0,0,1024,1024_SX48_.png",True,B09ZXLRRHY,2024-05-04,176.0,positive,"['amazing', 'great', 'perfect']",0.9995,electronics
359,36,B09ZX1LRXX,"Amazon Echo Pop (newest model), Our smallest Alexa speaker, Just right for bathrooms, dens and other small spaces, Midnight T",$17.99,4.7,69855,https://www.amazon.com/dp/B09ZX1LRXX,"https://images-na.ssl-images-amazon.com/images/I/71pEY++5qXL._AC_UL900_SR900,600_.jpg",7378,70289,RAZDNZHIEAFX1,Surprisingly simple for those of us who are new to smart devices & automation,"I found a great Prime Day deal on Kasa smart plugs, and though I already have an app to control them, I decided to see if the Echo Dot they're compatible with was also on sale.  That's when I happened across this Echo Pop for less than half price -- yay Prime Day!  I had seen it before, but I kind of dismissed it, since I have no need for any speakers.  I simply didn't realize that a smart speaker isn't just for playing music and podcasts.  Fortunately, I took a closer look this time and realized this Echo Pop was exactly what I needed!

It was super-easy to set up, thanks in large part to being able to connect it to my Amazon account before I even completed check-out.  Now I can get the weather forecast, set reminders and alarms, and control my smart plugs by just talking to Alexa.  My smart plugs control lamps, fans, and things I want to be sure I always turn off or better yet, unplug, and I can now do all of that by talking to this Echo Pop.  I set up a second Echo Pop up in my bedroom, and I love how it works.  It tells me to get up, turns on my lamp, so I can't turn over and fall back asleep, and pretty much replaces my old style alarm clock.  I feel kinda dumb for not giving the Echo Pop a closer look when it first came out, but then again I'm glad I got it on super sale!

Update: while I'm just loved controlling my smart plugs and devices through with voice with the Echo Pop or through the Alexa app on my phone, I decided I also needed an Echo Show, so I could check my security camera feeds. Big mistake. Although I got a $30 deal through Amazon Warehouse, the Echo Show was a big disappointment, slow to respond and much more tedious to set up thanks to a million options. Plus, it was absolutely loaded with annoying ads. Within 2 hours, I missed the perfect performance and simplicity of my awesome little Echo Pop, so the Echo Show went back in the box for a refund, and I'm back to enjoying life with my Echo Pop.

I've also since purchased a third Echo Pop, this one in Midnight Teal to put in my bathroom.  Sounds like a strange spot, but hear me out.  I'm an older woman who lives alone, and I subscribe to the Alexa ""Call for Help"" service, and since a slip and fall in the bathroom isn't an impossible situation, I thought it would be smart to make sure a speaker is nearby when I'm in there as well.  Plus, the Midnight Teal is an almost exact match for the color scheme in that room, so clearly this is meant to be.",5,https://www.amazon.com/gp/customer-reviews/RAZDNZHIEAFX1,"https://images-na.ssl-images-amazon.com/images/S/amazon-avatars-global/default._CR0,0,1024,1024_SX48_.png",True,B09WNK39JN,2024-07-19,3.0,positive,"['great', 'perfect', 'love', 'life']",0.9973,electronics
360,37,B09B9CD1YB,"Amazon Echo Dot Kids (newest model), Designed for kids, with parental controls, Includes 1 Year of Amazon Kids+, Owl",$27.99,4.7,13709,https://www.amazon.com/dp/B09B9CD1YB,"https://images-na.ssl-images-amazon.com/images/I/71RaitckuRL._AC_UL900_SR900,600_.jpg",1251,13750,R29GI4QRTJ1NN7,"Fun, Safe, and Perfect for Kids! ⭐⭐⭐⭐⭐","The Amazon Echo Dot Kids (newest model) is an absolute hit in our household! It’s specifically designed for kids with safety in mind, featuring robust parental controls that give me peace of mind. The device is super easy to set up and includes a 1-year subscription to Amazon Kids+, which is packed with kid-friendly content like games, music, and audiobooks.

The sound quality is great, and the cute design makes it appealing for little ones. My kids love asking Alexa questions, setting timers, and listening to their favorite stories and songs. It’s also a helpful tool for routines like bedtime and homework.

If you’re looking for a smart speaker that’s fun, educational, and safe for kids, this is the perfect choice. Highly recommend for any family!",5,https://www.amazon.com/gp/customer-reviews/R29GI4QRTJ1NN7,"https://images-na.ssl-images-amazon.com/images/S/amazon-avatars-global/9ac2d29a-a357-454b-bc24-851b3b545653._CR0,0,500,500_SX48_.jpg",True,B09B9CD1YB,2024-11-22,4.0,positive,"['great', 'perfect', 'love']",0.9948,electronics
361,37,B09B9CD1YB,"Amazon Echo Dot Kids (newest model), Designed for kids, with parental controls, Includes 1 Year of Amazon Kids+, Owl",$27.99,4.7,13709,https://www.amazon.com/dp/B09B9CD1YB,"https://images-na.ssl-images-amazon.com/images/I/71RaitckuRL._AC_UL900_SR900,600_.jpg",1251,13750,R2VN2DDJGPMAJT,"Perfect for a Kid-Friendly Smart Room – Engaging, Educational, and Fun!","I love this smart device for my toddler’s room! The cute design and variety of fun voices make it super engaging. One of my favorite features is the 'Daily News Just for Kids,' which shares fun science facts and new discoveries each day. There are also plenty of kid-friendly skills—like Amazon Storytime for bedtime and music playback for favorite songs during the day. The first year of the subscription is free, with a small fee afterward (check the terms), but it's definitely worth it. I also turned my toddler’s room into a smart room, so he can ask Alexa to turn the lights on and off since he can’t reach the switch yet. It’s educational and convenient, and my child loves interacting with it!",5,https://www.amazon.com/gp/customer-reviews/R2VN2DDJGPMAJT,"https://images-na.ssl-images-amazon.com/images/S/amazon-avatars-global/default._CR0,0,1024,1024_SX48_.png",True,B09B96PMLY,2024-11-14,7.0,positive,['love'],0.9864,electronics
362,37,B09B9CD1YB,"Amazon Echo Dot Kids (newest model), Designed for kids, with parental controls, Includes 1 Year of Amazon Kids+, Owl",$27.99,4.7,13709,https://www.amazon.com/dp/B09B9CD1YB,"https://images-na.ssl-images-amazon.com/images/I/71RaitckuRL._AC_UL900_SR900,600_.jpg",1251,13750,R30WN42RRSG7MR,We love our Alexa,"The owl design of the Alexa speaker is absolutely charming and a delightful addition to any room. Its whimsical look makes it especially appealing for kids' rooms or as a fun decorative piece. Beyond the design, it functions just as well as any other Alexa device, providing all the usual smart assistant features like controlling smart home devices, playing music, setting reminders, and answering questions. The sound quality is surprisingly good for its size, and the owl theme adds a playful touch that makes interacting with Alexa more enjoyable. It’s both functional and fun, making it a great purchase!",5,https://www.amazon.com/gp/customer-reviews/R30WN42RRSG7MR,"https://images-na.ssl-images-amazon.com/images/S/amazon-avatars-global/5338509e-e8c8-41a9-9aa6-d862a9c56874._CR0,0,493,493_SX48_.jpg",True,B09B9CD1YB,2024-08-21,18.0,positive,['great'],0.9909,electronics
363,37,B09B9CD1YB,"Amazon Echo Dot Kids (newest model), Designed for kids, with parental controls, Includes 1 Year of Amazon Kids+, Owl",$27.99,4.7,13709,https://www.amazon.com/dp/B09B9CD1YB,"https://images-na.ssl-images-amazon.com/images/I/71RaitckuRL._AC_UL900_SR900,600_.jpg",1251,13750,R1NPCA3UT7TSZ0,we LOVE it!,"We recently added the Echo Dot Owl to our home, and it has quickly become a favorite for my preschooler! The ability to control her nightlight and change its color to match her mood has made bedtime much more enjoyable. She loves experimenting with the different hues, creating a cozy atmosphere just for her.

What really impressed me is how well Alexa responds to her little voice. Even when she doesn’t articulate clearly, Alexa understands her requests—much better than I expected! My daughter enjoys asking for music, and I appreciate that it pulls from her Spotify Kids account, ensuring that the songs playing are always age-appropriate.

She’s also discovered the joy of storytelling; she frequently asks Alexa to tell her a story. We’ve started using it as a timer for her activities and even as a gentle alarm in the mornings.

On top of all these fantastic features, the design of the Echo Dot Owl is super cute! We’re even considering getting the little nest stand for added charm. Overall, this device has been a wonderful addition to our home, providing entertainment, comfort, and a touch of magic for my child. I highly recommend it for any family with young kids!",5,https://www.amazon.com/gp/customer-reviews/R1NPCA3UT7TSZ0,"https://images-na.ssl-images-amazon.com/images/S/amazon-avatars-global/ca08e43c-3478-44d4-a1bc-7b17dd0999a2._CR0,34.0,265,265_SX48_.jpg",True,B09B9CD1YB,2024-09-20,18.0,positive,[],0.9963,electronics
364,37,B09B9CD1YB,"Amazon Echo Dot Kids (newest model), Designed for kids, with parental controls, Includes 1 Year of Amazon Kids+, Owl",$27.99,4.7,13709,https://www.amazon.com/dp/B09B9CD1YB,"https://images-na.ssl-images-amazon.com/images/I/71RaitckuRL._AC_UL900_SR900,600_.jpg",1251,13750,RVXAZIH5SWE94,Surprisingly loud speaker and fun theme,"I just recently purchased this for my son's 6th birthday to help him have an option for audiobooks, alarm clock, and listening to music and he LOVES it! He greets Alexa every time he gets home and says goodnight to her and gets a bedtime story from her while he waits for me to come read to him and tuck him in. We have successfully added a few Alexa skills (including Big Fart which MAY have been a mistake on my part) and so far they seem to work pretty well.

Pros:
- Cute dragon theme and image (Alexa introduces herself and says she likes to pretend she is a dragon and has a kid-friendly voice character)
- Optional additional Dragon Egg Cradle (have not personally purchased yet but am tempted)
- Great resource to allow kids access to audiobooks and learning materials with parental controls through the parent dashboard
- 1 year free subscription to Amazon Kids+ which is a great deal if you have an amazon kids tablet already (same price as you already pay for a year and an echo dot? Yes please!)
- An avenue for little ones to ask some of their random questions to someone other than overloaded parents
- Many cool Alexa skills from independent companies (Math practice games? Yes! Talk to Pikachu? Yes!)
- Alarm clock, speaker, nightlight and more in one!

Cons:
- Alexa can sometimes get very confused. This can be frustrating for anyone, but especially for little ones with little tolerance for the pitfalls of technology. Sometimes she doesn't hear you correctly and says she can't do something they know she can do. Sometimes she starts playing music while doing another skill and the speaker just can't take it. Sometimes she just plain doesn't listen the first 10 times you try and ask. It's........ frustrating and stressful when this happens to say the least. Teach your little one how to reset Alexa if this happens so they can feel in control instead of having a meltdown or running out screaming over her.
- Not all of the Alexa skills work quite how they are meant to and will totally mess Alexa up and require a reset and removal of the skill entirely.
- Alexa has very specific commands and these can be hard to remember sometimes. Consider writing out or typing up a list of the most common commands for little ones to help them remember the right order of words.
- The Echo dot can get surprisingly loud and when you ask Alexa to turn down the volume it is in very small increments so you will need to do it manually if they have somehow turned it up to blasting.
- After Alexa's bedtime has hit she will not respond to any commands or be able to use any skills. This includes asking her to stop playing something she already was, using a nightlight skill, or setting an alarm. The only option you have after her off time is to manually reset it so she goes quiet. The timer options are awesome tools to keep little ones from turning her on and playing with her instead of going to bed, but does restrict some of the bedtime options you could have like the nightlight.

Overall, we have loved our experience with this product so far and it has only been in use for about a week (but pretty constantly).  We'll see how this holds up over time!",4,https://www.amazon.com/gp/customer-reviews/RVXAZIH5SWE94,"https://images-na.ssl-images-amazon.com/images/S/amazon-avatars-global/default._CR0,0,1024,1024_SX48_.png",True,B09B96PMLY,2023-06-27,237.0,positive,['great'],0.9909,electronics
365,37,B09B9CD1YB,"Amazon Echo Dot Kids (newest model), Designed for kids, with parental controls, Includes 1 Year of Amazon Kids+, Owl",$27.99,4.7,13709,https://www.amazon.com/dp/B09B9CD1YB,"https://images-na.ssl-images-amazon.com/images/I/71RaitckuRL._AC_UL900_SR900,600_.jpg",1251,13750,R3PCXR3CJBALT5,Great for kids,Super cool for kids. My kiddo is 6 and can play any song she wants and ask a lot of questions like what the weather is or even what the capital of Canada is. Very cool item to have. It has a kids voice too that my kiddo loves. Great price also. Very easy to use.,5,https://www.amazon.com/gp/customer-reviews/R3PCXR3CJBALT5,"https://images-na.ssl-images-amazon.com/images/S/amazon-avatars-global/default._CR0,0,1024,1024_SX48_.png",True,B09B9CD1YB,2024-11-15,4.0,positive,['great'],0.9732,electronics
366,37,B09B9CD1YB,"Amazon Echo Dot Kids (newest model), Designed for kids, with parental controls, Includes 1 Year of Amazon Kids+, Owl",$27.99,4.7,13709,https://www.amazon.com/dp/B09B9CD1YB,"https://images-na.ssl-images-amazon.com/images/I/71RaitckuRL._AC_UL900_SR900,600_.jpg",1251,13750,RXF2GY8RH4HER,Really cute,I love our dragon echo dot. Works great and love the jokes it tells. It was a bit hard to connect,5,https://www.amazon.com/gp/customer-reviews/RXF2GY8RH4HER,"https://images-na.ssl-images-amazon.com/images/S/amazon-avatars-global/default._CR0,0,1024,1024_SX48_.png",True,B09B96PMLY,2024-11-19,0 people found this helpful,positive,"['great', 'love']",0.9337,electronics
